chapter,chapter_name,section_id,section_name,req_id,req_description,L,日本語訳,ステータス,対応方法,ドキュメント,実装確認結果,インフラリソース,エビデンス,要件対象リソース
V1,Encoding and Sanitization,V1.1,Encoding and Sanitization Architecture,V1.1.1,"Verify that input is decoded or unescaped into a canonical form only once, it is only decoded when encoded data in that form is expected, and that this is done before processing the input further, for example it is not performed after input validation or sanitization.",2,入力が正規形式に一度だけデコードまたはエスケープ解除されること、その形式のエンコードされたデータが期待される場合にのみデコードされること、そしてそれが入力をさらに処理する前に行われること（たとえば、入力の検証やサニタイズの後には実行されないこと）を確認してください。,対応済み,,対象外,要件を満たしている。¥nバックエンド（ECS）のFWとして `fastify` を採用しており、リクエストボディやURLのデコードはFastifyのパースフェーズで自動的かつ一度だけ行われる。その後 `fastify` プラグイン内で正規化されたデータが利用され、入力検証後に再デコードが行われることはない。,対象外,server/service/app.ts¥nFastifyの基本仕様,ソースコード
V1,Encoding and Sanitization,V1.1,Encoding and Sanitization Architecture,V1.1.2,Verify that the application performs output encoding and escaping either as a final step before being used by the interpreter for which it is intended or by the interpreter itself.,2,アプリケーションが、意図されたインタプリタで使用される前の最終ステップとして、またはインタプリタ自体によって、出力のエンコーディングおよびエスケープを実行することを確認してください。,対応済み,,対象外,要件を満たしている。¥nフロントエンドFWとして `React` を使用しており、JSXによるDOMレンダリング時に変数が自動的にエスケープ（出力エンコーディング）される。XSS保護を無効化する `dangerouslySetInnerHTML` は不要な箇所では使用しておらず、必要な場合は `DOMPurify` 等でサニタイズする設計としている。,対象外,client/app/ や client/components/ などのコンポーネント実装¥nReactの基本仕様,ソースコード
V1,Encoding and Sanitization,V1.2,Injection Prevention,V1.2.1,"Verify that output encoding for an HTTP response, HTML document, or XML document is relevant for the context required, such as encoding the relevant characters for HTML elements, HTML attributes, HTML comments, CSS, or HTTP header fields, to avoid changing the message or document structure.",1,HTTPレスポンス、HTMLドキュメント、またはXMLドキュメントの出力エンコーディングが、HTML要素、HTML属性、HTMLコメント、CSS、またはHTTPヘッダーフィールドなど、必要なコンテキストに対して適切であることを確認し、メッセージやドキュメントの構造が変更されないようにしてください。,対応済み,,対象外,要件を満たしている。¥nバックエンド（`fastify`）のレスポンスはデフォルトで `application/json; charset=utf-8` 等の適切な Content-Type が付与され、ブラウザがJSONをHTMLとして誤認してスクリプトを実行するリスクを防いでいる。,対象外,server/service/app.ts のルーティング設定,ドキュメント
V1,Encoding and Sanitization,V1.2,Injection Prevention,V1.2.2,"Verify that when dynamically building URLs, untrusted data is encoded according to its context (e.g., URL encoding or base64url encoding for query or path parameters). Ensure that only safe URL protocols are permitted (e.g., disallow javascript: or data:).",1,URLを動的に構築する際、信頼できないデータがそのコンテキストに従ってエンコードされていること（例：クエリパラメータやパスパラメータのURLエンコーディングまたはbase64urlエンコーディング）を確認してください。安全なURLプロトコルのみが許可されていることを確認してください（例：「javascript:」や「data:」を許可しない）。,対応済み,,対象外,要件を満たしている。¥nフロントエンド（`Next.js`）での動的URL生成には `pathpida` 等を用いて型安全なパス生成を行っており、APIリクエストには `aspida` を用いることでパラメータは自動的にURLエンコードされる。また、外部入力を直接 `href` 等に割り当てる際も javascript: などの危険なプロトコルは許可していない。,対象外,client/utils/ 等のURL生成ロジック,ソースコード
V1,Encoding and Sanitization,V1.2,Injection Prevention,V1.2.3,"Verify that output encoding or escaping is used when dynamically building JavaScript content (including JSON), to avoid changing the message or document structure (to avoid JavaScript and JSON injection).",1,JavaScriptコンテンツ（JSONを含む）を動的に構築する際、メッセージやドキュメントの構造が変更されるのを防ぐ（JavaScriptおよびJSONインジェクションを防ぐ）ために、出力エンコーディングまたはエスケープが使用されていることを確認してください。,対応済み,,対象外,要件を満たしている。¥nReact/Next.jsの状態管理やFastifyからのAPIレスポンスにおいて、データは標準のJSONとして処理され、動的にJSコードとして評価されること（eval等）はない。JSON.parse() のみが使用されており安全である。,対象外,client/ および server/ のデータパース実装,ドキュメント
V1,Encoding and Sanitization,V1.2,Injection Prevention,V1.2.4,"Verify that data selection or database queries (e.g., SQL, HQL, NoSQL, Cypher) use parameterized queries, ORMs, entity frameworks, or are otherwise protected from SQL Injection and other database injection attacks. This is also relevant when writing stored procedures.",1,データの選択またはデータベースクエリ（SQL、HQL、NoSQL、Cypherなど）が、パラメータ化クエリ、ORM、エンティティフレームワークを使用しているか、その他の方法でSQLインジェクションやその他のデータベースインジェクション攻撃から保護されていることを確認してください。これはストアドプロシージャを記述する際にも該当します。,対応済み,,対象外,要件を満たしている。¥nデータベース操作には `Prisma` (ORM) を使用しており、パラメータ化クエリが強制されるため、意図しないSQLインジェクションは構造的に対策されている。文字列連結によるクエリ構築は行われていない。,対象外,server/service/prisma.ts¥nserver/repository/ 内のクエリ実装,ソースコード
V1,Encoding and Sanitization,V1.2,Injection Prevention,V1.2.5,Verify that the application protects against OS command injection and that operating system calls use parameterized OS queries or use contextual command line output encoding.,1,アプリケーションがOSコマンドインジェクション攻撃から保護されていること、およびオペレーティングシステム呼び出しがパラメータ化されたOSクエリを使用するか、コンテキストに応じたコマンドライン出力エンコーディングを使用していることを確認してください。,対応済み,,対象外,要件を満たしている。¥nバックエンド（Node.js）において、ユーザー入力を直接用いたOSコマンド実行（exec等）は行われていない。実行が必要な場合でも、child_process.spawn 等を用いてコマンドと引数を厳密に分離する設計としている。,対象外,server/ 内のOSプロセス呼び出し実装（存在しないことの確認）,ソースコード
V1,Encoding and Sanitization,V1.2,Injection Prevention,V1.2.6,"Verify that the application protects against LDAP injection vulnerabilities, or that specific security controls to prevent LDAP injection have been implemented.",2,アプリケーションがLDAPインジェクションの脆弱性から保護されていること、またはLDAPインジェクションを防ぐための特定のセキュリティ制御が実装されていることを確認してください。,対応済み,,対象外,要件を満たしている。¥n本システムではLDAPは使用しておらず、認証にはAWS Cognitoを利用しているためLDAPインジェクションのリスクは構造上存在しない。,対象外,インフラ構成（Cognitoの使用）,ソースコード
V1,Encoding and Sanitization,V1.2,Injection Prevention,V1.2.7,Verify that the application is protected against XPath injection attacks by using query parameterization or precompiled queries.,2,クエリのパラメータ化またはプリコンパイル済みクエリを使用することにより、アプリケーションがXPathインジェクション攻撃から保護されていることを確認してください。,対応済み,,対象外,要件を満たしている。¥nシステム内でXMLやXPathをパース・クエリする機能は実装されておらず、データフォーマットは一貫してJSONを使用しているためリスクはない。,対象外,server/ 処理フロー全体,ソースコード
V1,Encoding and Sanitization,V1.2,Injection Prevention,V1.2.8,"Verify that LaTeX processors are configured securely (such as not using the ""--shell-escape"" flag) and an allowlist of commands is used to prevent LaTeX injection attacks.",2,LaTeXプロセッサが安全に設定されていること（「--shell-escape」フラグを使用しないなど）、およびLaTeXインジェクション攻撃を防ぐためにコマンドの許可リストが使用されていることを確認してください。,対象外,,対象外,要件を満たしている（該当機能なし）。¥n本システムではLaTeX等によるドキュメントの動的生成機能は提供していない。,対象外,対象外,ソースコード
V1,Encoding and Sanitization,V1.2,Injection Prevention,V1.2.9,Verify that the application escapes special characters in regular expressions (typically using a backslash) to prevent them from being misinterpreted as metacharacters.,2,正規表現内の特殊文字がメタ文字として誤って解釈されるのを防ぐために、アプリケーションがそれらをエスケープしていること（通常はバックスラッシュを使用）を確認してください。,対象外,,対象外,実装は対象外。¥n要件を満たしている（該当リスクなし）。ユーザーの入力値を用いて正規表現を動的に組み立てる処理は存在しないため、エスケープ処理は不要である。,対象外,対象外,ソースコード
V1,Encoding and Sanitization,V1.2,Injection Prevention,V1.2.10,"Verify that the application is protected against CSV and Formula Injection. The application must follow the escaping rules defined in RFC 4180 sections 2.6 and 2.7 when exporting CSV content. Additionally, when exporting to CSV or other spreadsheet formats (such as XLS, XLSX, or ODF), special characters (including '=', '+', '-', '@', '\t' (tab), and '\0' (null character)) must be escaped with a single quote if they appear as the first character in a field value.",3,アプリケーションがCSVおよび数式インジェクションから保護されていることを確認してください。アプリケーションは、CSVコンテンツをエクスポートする際にRFC 4180のセクション2.6および2.7で定義されたエスケープ規則に従う必要があります。さらに、CSVまたはその他のスプレッドシート形式にエクスポートする場合、特殊文字（「=」、「+」、「-」、「@」、「\t」、「\0」を含む）がフィールド値の最初の文字として表示される場合は、シングルクォートでエスケープする必要があります。,対象外,,対象外,要件を満たしている（該当機能なし）。¥n現状、システム内でユーザー入力を含むCSVやスプレッドシートの動的生成・エクスポート機能は提供していない。,対象外,対象外,ソースコード
V1,Encoding and Sanitization,V1.3,Sanitization,V1.3.1,Verify that all untrusted HTML input from WYSIWYG editors or similar is sanitized using a well-known and secure HTML sanitization library or framework feature.,1,WYSIWYGエディタなどからの信頼できないすべてのHTML入力が、よく知られた安全なHTMLサニタイズライブラリまたはフレームワークの機能を使用してサニタイズされていることを確認してください。,対象外,,対象外,要件を満たしている（該当機能なし）。¥n本システムではWYSIWYGエディタ等によるHTMLの直接入力を受け付ける機能は存在しない。,対象外,対象外,ソースコード
V1,Encoding and Sanitization,V1.3,Sanitization,V1.3.2,"Verify that the application avoids the use of eval() or other dynamic code execution features such as Spring Expression Language (SpEL). Where there is no alternative, any user input being included must be sanitized before being executed.",1,アプリケーションが「eval()」やSpring Expression Language (SpEL) のようなその他の動的コード実行機能の使用を避けていることを確認してください。代替手段がない場合、含まれるユーザー入力は実行前にサニタイズされなければなりません。,対応済み,,対象外,要件を満たしている。¥nフロントエンド（React/Next.js）およびバックエンド（Fastify/Node.js）の双方において、eval()やnew Function()、SpEL等の動的コード実行機能は使用していない。,対象外,全ソースコード検索による確認,ソースコード
V1,Encoding and Sanitization,V1.3,Sanitization,V1.3.3,"Verify that data being passed to a potentially dangerous context is sanitized beforehand to enforce safety measures, such as only allowing characters which are safe for this context and trimming input which is too long.",2,潜在的に危険なコンテキストに渡されるデータが、このコンテキストに対して安全な文字のみを許可したり、長すぎる入力をトリミングしたりするなど、安全対策を強制するために事前にサニタイズされていることを確認してください。,対応済み,,対象外,要件を満たしている。¥nシステム外からの入力データはすべて、処理される前に `zod` を用いたスキーマバリデーションを通過し、文字種や文字列長の上限チェックが強制される。,対象外,server/validators/ 等のZodスキーマ定義,ソースコード
V1,Encoding and Sanitization,V1.3,Sanitization,V1.3.4,"Verify that user-supplied Scalable Vector Graphics (SVG) scriptable content is validated or sanitized to contain only tags and attributes (such as draw graphics) that are safe for the application, e.g., do not contain scripts and foreignObject.",2,ユーザーから提供されたスケーラブルベクターグラフィックス（SVG）のスクリプト可能なコンテンツが、アプリケーションにとって安全なタグと属性のみを含むように検証またはサニタイズされていること、例えばスクリプトや「foreignObject」を含まないことを確認してください。,未対応,zod等を用いて、アップロードされた画像がSVG形式でないか（Content-Typeおよびマジックバイト等の検証により）確認し、SVGの場合は拒否するか、またはサニタイズする処理を実装する。,対象外,未対応。¥n現在タスク画像として任意のファイルアップロードが可能であり、SVGに対する検証・サニタイズ処理が存在しないため。,対象外,対象外,ソースコード
V1,Encoding and Sanitization,V1.3,Sanitization,V1.3.5,"Verify that the application sanitizes or disables user-supplied scriptable or expression template language content, such as Markdown, CSS or XSL stylesheets, BBCode, or similar.",2,アプリケーションが、Markdown、CSSまたはXSLスタイルシート、BBCodeなどのような、ユーザー提供のスクリプト可能なコンテンツまたは式テンプレート言語のコンテンツをサニタイズまたは無効化することを確認してください。,対象外,,対象外,要件を満たしている（該当機能なし）。¥nシステム内でユーザーが独自のマークアップ（Markdown、カスタムCSS等）を入力・表示できる機能は存在しない。,対象外,対象外,ソースコード
V1,Encoding and Sanitization,V1.3,Sanitization,V1.3.6,"Verify that the application protects against Server-side Request Forgery (SSRF) attacks, by validating untrusted data against an allowlist of protocols, domains, paths and ports and sanitizing potentially dangerous characters before using the data to call another service.",2,サーバーサイドリクエストフォージェリ（SSRF）攻撃から保護されていることを確認してください。これは、信頼できないデータをプロトコル、ドメイン、パス、ポートの許可リストに対して検証し、データを使用して別のサービスを呼び出す前に潜在的に危険な文字をサニタイズすることによって行われます。,対応済み,,対象外,要件を満たしている。¥nバックエンド（ECS）から外部サービスへHTTPリクエストを行う際、ユーザー入力のURLを直接呼び出す処理は実装されておらず、SSRFのリスクは防止されている。,対象外,server/ 内の外部API呼び出し実装,ソースコード
V1,Encoding and Sanitization,V1.3,Sanitization,V1.3.7,"Verify that the application protects against template injection attacks by not allowing templates to be built based on untrusted input. Where there is no alternative, any untrusted input being included dynamically during template creation must be sanitized or strictly validated.",2,信頼できない入力に基づいてテンプレートが構築されることを許可しないことにより、アプリケーションがテンプレートインジェクション攻撃から保護されていることを確認してください。代替手段がない場合、テンプレート作成時に動的に含まれる信頼できない入力は、サニタイズされるか厳格に検証されなければなりません。,対応済み,,対象外,要件を満たしている。¥nバックエンドはJSON APIとして機能し、サーバーサイドテンプレートエンジン（EJS、Pug等）は使用していないため、テンプレートインジェクションのリスクはない。,対象外,server/ のレンダリング非実施確認,ソースコード
V1,Encoding and Sanitization,V1.3,Sanitization,V1.3.8,Verify that the application appropriately sanitizes untrusted input before use in Java Naming and Directory Interface (JNDI) queries and that JNDI is configured securely to prevent JNDI injection attacks.,2,Java Naming and Directory Interface (JNDI) クエリで使用する前に、アプリケーションが信頼できない入力を適切にサニタイズしていること、およびJNDIインジェクション攻撃を防ぐためにJNDIが安全に設定されていることを確認してください。,対象外,,対象外,実装は対象外。¥n要件を満たしている。本システムはTypeScript/Node.jsベース（React/Fastify）であり、Java固有のJNDIは使用していない。,対象外,対象外,ソースコード
V1,Encoding and Sanitization,V1.3,Sanitization,V1.3.9,Verify that the application sanitizes content before it is sent to memcache to prevent injection attacks.,2,インジェクション攻撃を防ぐために、memcacheに送信する前にアプリケーションがコンテンツをサニタイズすることを確認してください。,対象外,,対象外,実装は対象外。¥n本システムではMemcache等のインメモリキャッシュストアは使用しておらず、該当リスクはない。,対象外,対象外,ソースコード
V1,Encoding and Sanitization,V1.3,Sanitization,V1.3.10,Verify that format strings which might resolve in an unexpected or malicious way when used are sanitized before being processed.,2,使用時に予期しない、または悪意のある方法で解決される可能性のあるフォーマット文字列が、処理される前にサニタイズされていることを確認してください。,対応済み,,対象外,要件を満たしている。¥nフォーマット文字列攻撃のリスクがあるC言語のprintfのような動的フォーマット評価はNode.js/TypeScriptの標準機能には存在せず、テンプレートリテラルは安全に評価される。,対象外,全ソースコード（TS）,ソースコード
V1,Encoding and Sanitization,V1.3,Sanitization,V1.3.11,Verify that the application sanitizes user input before passing to mail systems to protect against SMTP or IMAP injection.,2,SMTPまたはIMAPインジェクションから保護するために、メールシステムに渡す前にアプリケーションがユーザー入力をサニタイズすることを確認してください。,対象外,,対象外,要件を満たしている（該当機能なし）。¥nアプリケーションから直接SMTP/IMAPでメール送信を行う機能は存在しない。AWS SES等のマネージドサービス経由でも、ユーザー入力を直接ヘッダーに注入するような構成はない。,対象外,対象外,ソースコード
V1,Encoding and Sanitization,V1.3,Sanitization,V1.3.12,"Verify that regular expressions are free from elements causing exponential backtracking, and ensure untrusted input is sanitized to mitigate ReDoS or Runaway Regex attacks.",3,正規表現に指数関数的なバックトラッキングを引き起こす要素が含まれていないことを確認し、ReDoS（正規表現のサービス拒否）または暴走正規表現攻撃を軽減するために信頼できない入力がサニタイズされていることを確認してください。,対象外,,対象外,実装は対象外。¥n要件を満たしている。入力バリデーション（zod）で使用する正規表現は、バックトラッキングが爆発しないよう単純なパターンに限定しており、ReDoS攻撃を軽減している。,対象外,server/common/validators/ 等の正規表現定義,ソースコード
V1,Encoding and Sanitization,V1.4,"Memory, String, and Unmanaged Code",V1.4.1,"Verify that the application uses memory-safe string, safer memory copy and pointer arithmetic to detect or prevent stack, buffer, or heap overflows.",2,アプリケーションが、スタック、バッファ、またはヒープのオーバーフローを検出または防止するために、メモリセーフな文字列、より安全なメモリコピー、およびポインタ演算を使用していることを確認してください。,対応済み,,対象外,要件を満たしている。¥nJavaScript/TypeScriptはメモリセーフな言語であり、V8エンジンによってバッファオーバーフロー等のメモリアクセス違反は自動的に防止される。,対象外,言語仕様 (TypeScript/Node.js),ソースコード
V1,Encoding and Sanitization,V1.4,"Memory, String, and Unmanaged Code",V1.4.2,"Verify that sign, range, and input validation techniques are used to prevent integer overflows.",2,整数オーバーフローを防止するために、符号、範囲、および入力検証の技術が使用されていることを確認してください。,対応済み,,対象外,要件を満たしている。¥nzodによるスキーマバリデーションにて、数値入力に対して `z.number().min().max()` などを用いて適切な範囲検証を実施し、オーバーフロー/アンダーフローを防いでいる。,対象外,server/validators/ の数値バリデーション,ソースコード
V1,Encoding and Sanitization,V1.4,"Memory, String, and Unmanaged Code",V1.4.3,"Verify that dynamically allocated memory and resources are released, and that references or pointers to freed memory are removed or set to null to prevent dangling pointers and use-after-free vulnerabilities.",2,動的に割り当てられたメモリとリソースが解放されていること、およびダングリングポインタと解放後使用（use-after-free）の脆弱性を防ぐために、解放されたメモリへの参照またはポインタが削除されるかnullに設定されていることを確認してください。,対応済み,,対象外,要件を満たしている。¥nJavaScript/TypeScriptのガベージコレクションによってメモリは自動管理されるため、解放後使用（Use-After-Free）やダングリングポインタの問題は発生しない。,対象外,言語仕様 (TypeScript/Node.js),ソースコード
