V7,Session Management,V7.5,Defenses Against Session Abuse,V7.5.2,Verify that users are able to view and (having authenticated again with at least one factor) terminate any or all currently active sessions.,2,ユーザーが（少なくとも1つの要素で再度認証された後）、現在アクティブな任意のまたはすべてのセッションを表示し、終了できることを確認してください。,未対応,Cognitoのデバイストラッキング機能（Remembered Devices）等を有効化し、ユーザーが現在ログイン中のデバイス一覧を確認し、個別に終了（ログアウト）できるUIを実装すること。,対象外,未対応。¥nユーザー自身が現在のアクティブなセッション（デバイス）を表示し、選択して終了させる機能が実装されていない。,Amazon Cognito,セッション管理画面の実装コード（該当する場合）,ソースコード
V7,Session Management,V7.5,Defenses Against Session Abuse,V7.5.3,Verify that the application requires further authentication with at least one factor or secondary verification before performing highly sensitive transactions or operations.,3,アプリケーションが、非常に機密性の高いトランザクションや操作を実行する前に、少なくとも1つの要素による追加の認証（authentication）または二次検証を要求することを確認してください。,対象外,,対象外,"要件を満たしている。
パスワード変更完了時、Cognitoの仕様によりこれまで発行されていた全てのアクティブなセッション（トークン）が全デバイスで自動的に無効化される。またフロントエンド側でも onSuccess={signOut} によりローカルセッションを破棄している。",対象外,高機密トランザクション実行時の追加認証（ステップアップ認証）ロジック,対象外
V7,Session Management,V7.6,Federated Re-authentication,V7.6.1,"Verify that session lifetime and termination between Relying Parties (RPs) and Identity Providers (IdPs) behave as documented, requiring re-authentication as necessary such as when the maximum time between IdP authentication events is reached.",2,リライングパーティ（RP）とアイデンティティプロバイダー（IdP）間のセッション有効期間と終了が文書化されている通りに動作し、IdP認証イベント間の最大時間に達した場合など、必要に応じて再認証を要求することを確認してください。,未対応,Cognitoと外部IdP（Google等）間でのセッションライフタイムの同期、およびIdPのセッション切れに伴う再認証が仕様通りに正しく動作しているか確認し、設定を行うこと。,要ドキュメント（要件定義書、アーキテクチャ設計書等）,,Amazon Cognito,Cognitoの外部IdP連携設定,インフラリソース¥nドキュメント
V7,Session Management,V7.6,Federated Re-authentication,V7.6.2,"Verify that creation of a session requires either the user's consent or an explicit action, preventing the creation of new application sessions without user interaction.",2,セッションの作成にユーザーの同意または明示的なアクションが必要であり、ユーザーの操作なしに新しいアプリケーションセッションが作成されるのを防ぐことを確認してください。,対応済み,,対象外,SSO未対応,対象外,サインインフローのUIおよびバックエンド実装,対象外
V8,Authorization,V8.1,Authorization Documentation,V8.1.1,Verify that authorization documentation defines rules for restricting function-level and data-specific access based on consumer permissions and resource attributes.,1,認可（authorization）のドキュメントに、コンシューマーの権限とリソース属性に基づいて、機能レベルおよびデータ固有のアクセスを制限するためのルールが定義されていることを確認してください。,確認中,機能レベルやデータ固有のアクセス制限に関するルールを要件定義書・設計書に明記すること。,要ドキュメント（要件定義書、認可設計書等）,実装は確認中。¥n現在のアプリケーションでは認可（ロール等）に関する仕様ドキュメントが存在しないため、作成が必要。,対象外,対象外,ドキュメント
V8,Authorization,V8.1,Authorization Documentation,V8.1.2,"Verify that authorization documentation defines rules for field-level access restrictions (both read and write) based on consumer permissions and resource attributes. Note that these rules might depend on other attribute values of the relevant data object, such as state or status.",2,認可（authorization）のドキュメントに、コンシューマーの権限とリソース属性に基づいて、フィールドレベルのアクセス制限（読み取りと書き込みの両方）のルールが定義されていることを確認してください。,確認中,フィールドレベルのアクセス制限に関するルールを設計書に明記すること。（該当しない場合はその旨を記載）,要ドキュメント（認可設計書等）,実装は確認中。¥nフィールドレベルのアクセス制限（BOPLA対策等）の設計に関するドキュメントが存在しないため、方針の明確化が必要。,対象外,対象外,ドキュメント
V8,Authorization,V8.1,Authorization Documentation,V8.1.3,"Verify that the application's documentation defines the environmental and contextual attributes (including but not limited to, time of day, user location, IP address, or device) that are used in the application to make security decisions, including those pertaining to authentication and authorization.",3,アプリケーションのドキュメントに、認証（authentication）および認可（authorization）に関するものを含め、アプリケーションでセキュリティ上の決定を行うために使用される環境およびコンテキスト属性（時刻、ユーザーの場所、IPアドレス、デバイスなど）が定義されていることを確認してください。,確認中,セキュリティ判断に用いる環境属性や状況属性（IPアドレス、デバイス、時刻等）の定義をドキュメント化すること。（用いない場合はその旨を記載）,要ドキュメント（セキュリティ要件定義書等）,実装は確認中。¥n環境属性を用いたセキュリティ判断の有無や仕様についてのドキュメントが存在しない。,対象外,対象外,ドキュメント
V8,Authorization,V8.1,Authorization Documentation,V8.1.4,"Verify that authentication and authorization documentation defines how environmental and contextual factors are used in decision-making, in addition to function-level, data-specific, and field-level authorization. This should include the attributes evaluated, thresholds for risk, and actions taken (e.g., allow, challenge, deny, step-up authentication).",3,認証（authentication）および認可（authorization）のドキュメントに、機能レベル、データ固有、フィールドレベルの認可に加えて、環境およびコンテキスト要因が意思決定においてどのように使用されるかが定義されていることを確認してください。,確認中,環境・状況要因を認可の判断にどのように用いるか（リスクのしきい値やステップアップ認証等）をドキュメントに明記すること。,要ドキュメント（認可設計書等）,実装は確認中。¥n環境要因を用いた高度な認可制御に関する仕様ドキュメントが存在しない。,対象外,対象外,ドキュメント
V8,Authorization,V8.2,General Authorization Design,V8.2.1,Verify that the application ensures that function-level access is restricted to consumers with explicit permissions.,1,アプリケーションが、機能レベルのアクセスを明示的な権限を持つコンシューマーに制限していることを確認してください。,対象外,,対象外,対象外。¥n本アプリケーションには管理者等のロール（役割）ベースの機能アクセス制御が存在せず、ログイン済みの全ユーザーが同一の機能（タスク管理等）を利用する仕様であるため対象外とする。¥n（※「明示的な権限」の例としては、「管理者権限」や「特定のロール権限」などが挙げられるが、本システムでは該当しない。）,対象外,ロール定義を持たない DB スキーマ (schema.prisma) および API 仕様,対象外
V8,Authorization,V8.2,General Authorization Design,V8.2.2,Verify that the application ensures that data-specific access is restricted to consumers with explicit permissions to specific data items to mitigate insecure direct object reference (IDOR) and broken object level authorization (BOLA).,1,アプリケーションが、安全でない直接オブジェクト参照（IDOR）および壊れたオブジェクトレベルの認可（BOLA）を軽減するために、特定のデータ項目へのアクセスを明示的な権限を持つコンシューマーに制限していることを確認してください。,対応済み,,対象外,要件を満たしている。¥nタスク（データ）へのアクセス・更新・削除時には、常に操作対象のタスクの authorId と JWTから取得したリクエスト送信者の user.id が一致するか検証 (assert) されており、IDORやBOLAを防いでいる。,対象外,server/domain/task/store/toTaskDto.ts 内の所有権検証ロジック (assert(user.id === prismaTask.authorId)),ソースコード
V8,Authorization,V8.2,General Authorization Design,V8.2.3,Verify that the application ensures that field-level access is restricted to consumers with explicit permissions to specific fields to mitigate broken object property level authorization (BOPLA).,2,アプリケーションが、壊れたオブジェクトプロパティレベルの認可（BOPLA）を軽減するために、特定のフィールドへのアクセスを明示的な権限を持つコンシューマーに制限していることを確認してください。,対象外,,対象外,対象外。¥nタスク情報において、データの所有者がアクセスを制限されるような隠蔽フィールド（BOPLAの対象となるようなプロパティ）が存在しないため。,対象外,TaskDto のフィールド定義,対象外
V8,Authorization,V8.2,General Authorization Design,V8.2.4,"Verify that adaptive security controls based on a consumer's environmental and contextual attributes (such as time of day, location, IP address, or device) are implemented for authentication and authorization decisions, as defined in the application's documentation. These controls must be applied when the consumer tries to start a new session and also during an existing session.",3,コンシューマーの環境およびコンテキスト属性（時刻、場所、IPアドレス、デバイスなど）に基づく適応型セキュリティ制御が、アプリケーションのドキュメントで定義されている通りに、認証および認可の決定のために実装されていることを確認してください。,対象外,,対象外,対象外。¥n本アプリケーションではIPアドレスやデバイス、時間帯に基づく適応型（コンテキストベース）のアクセス制御・認可は要求・実装されていないため対象外とする。,対象外,対象外,対象外
V8,Authorization,V8.3,Operation Level Authorization,V8.3.1,"Verify that the application enforces authorization rules at a trusted service layer and doesn't rely on controls that an untrusted consumer could manipulate, such as client-side JavaScript.",1,アプリケーションが信頼できるサービス層で認可（authorization）ルールを強制し、クライアントサイドのJavaScriptなど、信頼できないコンシューマーが操作できる制御に依存していないことを確認してください。,対応済み,,対象外,要件を満たしている。¥n認可の検証（ユーザーIDの検証とデータ所有権の確認）はすべてバックエンド（Node.js/Fastify）の信頼できるサービス層で実行されており、クライアント側の入力に依存していない。,対象外,バックエンドのAPIフックおよびドメイン層での所有権検証ロジック,ソースコード
V8,Authorization,V8.3,Operation Level Authorization,V8.3.2,"Verify that changes to values on which authorization decisions are made are applied immediately. Where changes cannot be applied immediately, (such as when relying on data in self-contained tokens), there must be mitigating controls to alert when a consumer performs an action when they are no longer authorized to do so and revert the change. Note that this alternative would not mitigate information leakage.",3,認可（authorization）の決定が行われる値の変更が直ちに適用されることを確認してください。,対象外,,対象外,対象外。¥n本アプリケーションではユーザーの権限（ロール）が変更される仕組みが存在しないため。,対象外,対象外,対象外
V8,Authorization,V8.3,Operation Level Authorization,V8.3.3,"Verify that access to an object is based on the originating subject's (e.g. consumer's) permissions, not on the permissions of any intermediary or service acting on their behalf. For example, if a consumer calls a web service using a self-contained token for authentication, and the service then requests data from a different service, the second service will use the consumer's token, rather than a machine-to-machine token from the first service, to make permission decisions.",3,オブジェクトへのアクセスが、ユーザーの代わりに行動する仲介者やサービスの権限ではなく、元の主体の権限に基づいていることを確認してください。,対象外,,対象外,対象外。¥n本アプリケーションはモノリスであり、サービス間でトークンを仲介して認可を行うようなマイクロサービスアーキテクチャではないため。,対象外,対象外,対象外
V8,Authorization,V8.4,Other Authorization Considerations,V8.4.1,Verify that multi-tenant applications use cross-tenant controls to ensure consumer operations will never affect tenants with which they do not have permissions to interact.,2,マルチテナントアプリケーションがクロステナント制御を使用し、コンシューマーの操作が、対話する権限を持たないテナントに影響を与えないことを保証していることを確認してください。,対象外,,対象外,対象外。¥nB2Bのマルチテナント型SaaSアプリケーションではなく、各ユーザーが独立して自身のタスクを管理するB2C型に近い構成であるため。ユーザー間のデータ分離は V8.2.2 で検証済み。,対象外,対象外,対象外
V8,Authorization,V8.4,Other Authorization Considerations,V8.4.2,"Verify that access to administrative interfaces incorporates multiple layers of security, including continuous consumer identity verification, device security posture assessment, and contextual risk analysis, ensuring that network location or trusted endpoints are not the sole factors for authorization even though they may reduce the likelihood of unauthorized access.",3,管理インターフェースへのアクセスには、継続的なコンシューマーID検証、デバイスのセキュリティ態勢評価、コンテキストリスク分析など、複数のセキュリティレイヤーが組み込まれており、ネットワークの場所や信頼できるエンドポイントが、認可（authorization）のための唯一の要素ではないことを確認してください。,対象外,,対象外,対象外。¥n本アプリケーションにはシステムを管理するための管理インターフェース（管理画面等）が存在しないため対象外とする。,対象外,対象外,対象外
V9,Self-contained Tokens,V9.1,Token source and integrity,V9.1.1,Verify that self-contained tokens are validated using their digital signature or MAC to protect against tampering before accepting the token's contents.,1,自己完結型トークンが、トークンの内容を受け入れる前に改ざんから保護するために、そのデジタル署名またはMACを使用して検証されることを確認してください。,対応済み,,対象外,要件を満たしている。¥nバックエンドは @fastify/jwt を用いて、Cognitoが発行したJWTのデジタル署名を検証してから内容を受け入れている。,対象外,server/service/app.ts の fastifyJwt 登録設定,ソースコード
V9,Self-contained Tokens,V9.1,Token source and integrity,V9.1.2,"Verify that only algorithms on an allowlist can be used to create and verify self-contained tokens, for a given context. The allowlist must include the permitted algorithms, ideally only either symmetric or asymmetric algorithms, and must not include the 'None' algorithm. If both symmetric and asymmetric must be supported, additional controls will be needed to prevent key confusion.",1,特定のコンテキストにおいて、許可リストにあるアルゴリズムのみが自己完結型トークンの作成と検証に使用できることを確認してください。,対応済み,,対象外,"要件を満たしている。¥nCognitoが指定するJWKS公開鍵（RSA非対称鍵）でのみ検証が行われ、alg:""none""等の無効なアルゴリズムは fastify/jwt 内部および JWKS エンドポイントの鍵検索フェーズで弾かれるため。",対象外,server/service/app.ts での getJwks.getPublicKey 呼び出し,ソースコード
V9,Self-contained Tokens,V9.1,Token source and integrity,V9.1.3,"Verify that key material that is used to validate self-contained tokens is from trusted pre-configured sources for the token issuer, preventing attackers from specifying untrusted sources and keys. For JWTs and other JWS structures, headers such as 'jku', 'x5u', and 'jwk' must be validated against an allowlist of trusted sources.",1,自己完結型トークンを検証するために使用される鍵素材が、トークン発行者のために事前に構成された信頼できるソースからのものであり、攻撃者が信頼できないソースや鍵を指定するのを防いでいることを確認してください。,対応済み,,対象外,要件を満たしている。¥nJWKSを取得するURLのドメインは、環境変数(COGNITO_POOL_ENDPOINTとCOGNITO_USER_POOL_ID)から構築される固定の信頼されたソースのみを使用しており、攻撃者が注入したヘッダー(jku等)から鍵を取得することはない。,対象外,server/service/app.ts の getJwks.getPublicKey 設定,ソースコード
V9,Self-contained Tokens,V9.2,Token content,V9.2.1,"Verify that, if a validity time span is present in the token data, the token and its content are accepted only if the verification time is within this validity time span. For example, for JWTs, the claims 'nbf' and 'exp' must be verified.",1,トークンデータに有効期間が存在する場合、検証時間がこの有効期間内である場合にのみ、トークンとその内容が受け入れられることを確認してください。,対応済み,,対象外,要件を満たしている。¥nfastify/jwt（内部の jsonwebtoken ライブラリ）のデフォルト動作により、nbf や exp クレームが存在する場合は自動的に有効期間が検証される。,対象外,server/service/app.ts の fastifyJwt 登録設定,ソースコード
V9,Self-contained Tokens,V9.2,Token content,V9.2.2,"Verify that the service receiving a token validates the token to be the correct type and is meant for the intended purpose before accepting the token's contents. For example, only access tokens can be accepted for authorization decisions and only ID Tokens can be used for proving user authentication.",2,トークンを受信するサービスが、トークンの内容を受け入れる前に、トークンが正しいタイプであり、意図された目的に対するものであることを検証することを確認してください。例えば、認可（authorization）の決定にはアクセストークンのみが受け入れられ、ユーザーの認証（authentication）を証明するためにはIDトークンのみが使用できます。,対応済み,,対象外,要件を満たしている。¥ncookieの idToken は fastify/jwt で認証（ユーザー識別）に用いられ、accessToken は Cognitoからユーザー属性を取得するためのIdPへのAPIコールに正しく使い分けられている。,対象外,server/api/private/hooks.ts における idToken と accessToken の使い分け,ソースコード
V9,Self-contained Tokens,V9.2,Token content,V9.2.3,"Verify that the service only accepts tokens which are intended for use with that service (audience). For JWTs, this can be achieved by validating the 'aud' claim against an allowlist defined in the service.",2,サービスが、そのサービス（オーディエンス）での使用を意図したトークンのみを受け入れることを確認してください。,対応済み,,対象外,要件を満たしている。¥nserver/service/app.ts の JWT検証ロジック内で、トークンの aud クレームが COGNITO_USER_POOL_CLIENT_ID と一致するかどうか明確に検証されている。,対象外,server/service/app.ts における assert((token.payload).aud === COGNITO_USER_POOL_CLIENT_ID),ソースコード
V9,Self-contained Tokens,V9.2,Token content,V9.2.4,"Verify that, if a token issuer uses the same private key for issuing tokens to different audiences, the issued tokens contain an audience restriction that uniquely identifies the intended audiences. This will prevent a token from being reused with an unintended audience. If the audience identifier is dynamically provisioned, the token issuer must validate these audiences in order to make sure that they do not result in audience impersonation.",2,トークン発行者が異なるオーディエンスにトークンを発行するために同じ秘密鍵を使用する場合、発行されたトークンには意図されたオーディエンスを一意に識別するオーディエンス制限が含まれていることを確認してください。,対応済み,,対象外,要件を満たしている。¥nCognitoが発行するトークンにはAudience（aud）制限が含まれており、アプリケーション側もそれを適切に検証している。,対象外,server/service/app.ts,ソースコード
V10,OAuth and OIDC,V10.1,Generic OAuth and OIDC Security,V10.1.1,"Verify that tokens are only sent to components that strictly need them. For example, when using a backend-for-frontend pattern for browser-based JavaScript applications, access and refresh tokens shall only be accessible for the backend.",2,トークンが、それらを厳密に必要とするコンポーネントにのみ送信されることを確認してください。,未対応,認可コードフロー全体をバックエンド（BFF）で処理し、フロントエンドJSがトークンに直接アクセスできないアーキテクチャに変更する。,対象外,要件を満たしていない。¥nフロントエンドのAWS Amplifyがブラウザ上でトークンを取得し、それをバックエンドに送信してHttpOnly Cookieに保存するフローとなっているため、一時的とはいえトークンがブラウザJSからアクセス可能な状態になっている。,対象外,フロントエンドの Amplify 認証処理および server/api/session/controller.ts,ソースコード
V10,OAuth and OIDC,V10.1,Generic OAuth and OIDC Security,V10.1.2,"Verify that the client only accepts values from the authorization server (such as the authorization code or ID Token) if these values result from an authorization flow that was initiated by the same user agent session and transaction. This requires that client-generated secrets, such as the proof key for code exchange (PKCE) 'code_verifier', 'state' or OIDC 'nonce', are not guessable, are specific to the transaction, and are securely bound to both the client and the user agent session in which the transaction was started.",2,クライアントが、認可（authorization）サーバーからの値（認可コードやIDトークンなど）を、同じユーザーエージェントセッションとトランザクションによって開始された認可フローの結果である場合にのみ受け入れることを確認してください。,対応済み,,対象外,要件を満たしている。¥nフロントエンドの AWS Amplify (Auth) が OIDC/OAuth フローにおいて PKCE (Proof Key for Code Exchange) および state パラメータの生成・検証を自動的に行い、セッションの紐付けを保証している。,対象外,AWS Amplify Auth モジュールの標準仕様,ソースコード
