V12,Secure Communication,V12.1,General TLS Security Guidance,V12.1.3,Verify that the application validates that mTLS client certificates are trusted before using the certificate identity for authentication or authorization.,2,証明書のアイデンティティを認証（authentication）または認可（authorization）に使用する前に、mTLSクライアント証明書が信頼されていることをアプリケーションが検証していることを確認してください。,対象外,,対象外,対象外。¥nアプリケーションでmTLSによるクライアント証明書認証を使用していないため。,API Gateway¥nALB,対象外,インフラリソース
V12,Secure Communication,V12.1,General TLS Security Guidance,V12.1.4,"Verify that proper certification revocation, such as Online Certificate Status Protocol (OCSP) Stapling, is enabled and configured.",3,Online Certificate Status Protocol (OCSP) Staplingなどの適切な証明書失効メカニズムが有効になり、構成されていることを確認してください。,対象外,,対象外,対象外。¥nL3要件であり対象外。,CloudFront¥nALB,対象外,インフラリソース
V12,Secure Communication,V12.1,General TLS Security Guidance,V12.1.5,"Verify that Encrypted Client Hello (ECH) is enabled in the application's TLS settings to prevent exposure of sensitive metadata, such as the Server Name Indication (SNI), during TLS handshake processes.",3,TLSハンドシェイクプロセス中にServer Name Indication (SNI) などの機密メタデータが漏洩するのを防ぐために、アプリケーションのTLS設定でEncrypted Client Hello (ECH) が有効になっていることを確認してください。,対象外,,対象外,対象外。¥nL3要件であり対象外。,CloudFront,対象外,インフラリソース
V12,Secure Communication,V12.2,HTTPS Communication with External Facing Services,V12.2.1,"Verify that TLS is used for all connectivity between a client and external facing, HTTP-based services, and does not fall back to insecure or unencrypted communications.",1,クライアントと外部向けのHTTPベースのサービス間のすべての接続にTLSが使用されており、安全でない通信や暗号化されていない通信にフォールバックしないことを確認してください。,確認中,CloudFrontおよびALBのリスナー設定にて、HTTPからHTTPSへのリダイレクト（Viewer Protocol Policy等）が設定されており、暗号化されていない通信を拒否できているか確認する。,対象外,インフラリソース（CloudFront/ALB等）でのHTTPS/TLS強制設定に依存するため確認中。,CloudFront¥nALB,未確認,インフラリソース
V12,Secure Communication,V12.2,HTTPS Communication with External Facing Services,V12.2.2,Verify that external facing services use publicly trusted TLS certificates.,1,外部向けサービスが、公的に信頼されたTLS証明書を使用していることを確認してください。,確認中,AWS Certificate Manager (ACM) などで発行・管理されている公的認証局（パブリックCA）の有効なTLS証明書が、CloudFrontおよびALBに正しくアタッチされているか確認する。,対象外,インフラリソース（AWS Certificate Manager等）で公的に信頼された証明書を発行・設定しているかに依存するため確認中。,AWS Certificate Manager (ACM),未確認,インフラリソース
V12,Secure Communication,V12.3,General Service to Service Communication Security,V12.3.1,"Verify that an encrypted protocol such as TLS is used for all inbound and outbound connections to and from the application, including monitoring systems, management tools, remote access and SSH, middleware, databases, mainframes, partner systems, or external APIs. The server must not fall back to insecure or unencrypted protocols.",2,監視システム、管理ツール、リモートアクセスとSSH、ミドルウェア、データベース、メインフレーム、パートナーシステム、外部APIを含む、アプリケーションとのすべての受信および送信接続に対して、TLSなどの暗号化プロトコルが使用されていることを確認してください。サーバーは安全でないプロトコルや暗号化されていないプロトコルへフォールバックしてはなりません。,確認中,ALBからECSコンテナへの通信、およびアプリケーションからRDS（データベース）等へのVPC内通信においてTLS接続が強制されているか確認する。また、外部APIやストレージ（Amazon S3など）への通信についても、SDKやバケットポリシー（aws:SecureTransport）によってHTTPSが強制されているか確認する。,対象外,データベース接続や内部コンポーネント間の通信がインフラ（VPCやRDS等）レベルで適切に暗号化・制御されているかに依存するため確認中。,VPC¥nALB¥nAmazon RDS¥nAmazon S3,未確認,インフラリソース
V12,Secure Communication,V12.3,General Service to Service Communication Security,V12.3.2,Verify that TLS clients validate certificates received before communicating with a TLS server.,2,TLSクライアントが、TLSサーバーと通信する前に受信した証明書を検証していることを確認してください。,対応済み,,対象外,要件を満たしている。¥nアプリケーション（Node.jsベース）は外部API通信等において、デフォルトでTLSサーバーの証明書検証を行う（NODE_TLS_REJECT_UNAUTHORIZEDなどを無効化していない）。,対象外,ソースコード上でのデフォルト動作,ソースコード
V12,Secure Communication,V12.3,General Service to Service Communication Security,V12.3.3,"Verify that TLS or another appropriate transport encryption mechanism used for all connectivity between internal, HTTP-based services within the application, and does not fall back to insecure or unencrypted communications.",2,アプリケーション内の内部的なHTTPベースのサービス間のすべての接続に、TLSまたはその他の適切なトランスポート暗号化メカニズムが使用されていることを確認してください。,確認中,VPC内部のHTTPベースのサービス間通信（例: マイクロサービス間）が適切にTLS化されているか、ネットワーク設定やサービスメッシュの設定等を確認する。,対象外,アプリケーション内部のHTTPベースのサービス間通信（同一EC2インスタンス内のプロセス間やコンテナ間通信等）の暗号化設定に依存するため確認中。,Amazon EC2¥nAmazon ECS,未確認,インフラリソース
V12,Secure Communication,V12.3,General Service to Service Communication Security,V12.3.4,"Verify that TLS connections between internal services use trusted certificates. Where internally generated or self-signed certificates are used, the consuming service must be configured to only trust specific internal CAs and specific self-signed certificates.",2,内部サービス間のTLS接続が、信頼できる証明書を使用していることを確認してください。,確認中,内部通信のTLS化に用いられている証明書が、AWS Certificate Manager Private CA (ACM PCA) のような信頼された内部CAから発行されたものか等、証明書の信頼性担保の仕組みを確認する。,対象外,インフラリソースでの内部通信と証明書構成に依存するため確認中。,AWS Certificate Manager (ACM)¥nVPC,未確認,インフラリソース
V12,Secure Communication,V12.3,General Service to Service Communication Security,V12.3.5,"Verify that services communicating internally within a system (intra-service communications) use strong authentication to ensure that each endpoint is verified. Strong authentication methods, such as TLS client authentication, must be employed to ensure identity, using public-key infrastructure and mechanisms that are resistant to replay attacks. For microservice architectures, consider using a service mesh to simplify certificate management and enhance security.",3,システム内部で通信するサービス（サービス間通信）が、各エンドポイントが検証されることを保証するために強力な認証（authentication）を使用していることを確認してください。,対象外,,対象外,対象外。¥nL3要件であり対象外。,AWS App Mesh¥nAmazon VPC Lattice,対象外,インフラリソース
V13,Configuration,V13.1,Configuration Documentation,V13.1.1,Verify that all communication needs for the application are documented. This must include external services which the application relies upon and cases where an end user might be able to provide an external location to which the application will then connect.,2,アプリケーションのすべての通信ニーズが文書化されていることを確認してください。,未対応,アプリケーションが依存する外部サービスや、エンドユーザーが指定可能な外部通信先を含む、すべての通信要件を設計書等にドキュメント化する。,要ドキュメント,現状ドキュメント化されていないため未対応。,対象外,ドキュメント（設計書など）,ドキュメント
V13,Configuration,V13.1,Configuration Documentation,V13.1.2,"Verify that for each service the application uses, the documentation defines the maximum number of concurrent connections (e.g., connection pool limits) and how the application behaves when that limit is reached, including any fallback or recovery mechanisms, to prevent denial of service conditions.",3,アプリケーションが使用する各サービスについて、ドキュメントに同時接続の最大数（接続プール制限など）と、その制限に達した際のアプリケーションの動作が定義されていることを確認してください。,対象外,,要ドキュメント,L3要件であり対象外。,対象外,対象外,ドキュメント
V13,Configuration,V13.1,Configuration Documentation,V13.1.3,"Verify that the application documentation defines resource‑management strategies for every external system or service it uses (e.g., databases, file handles, threads, HTTP connections). This should include resource‑release procedures, timeout settings, failure handling, and where retry logic is implemented, specifying retry limits, delays, and back‑off algorithms. For synchronous HTTP request–response operations it should mandate short timeouts and either disable retries or strictly limit retries to prevent cascading delays and resource exhaustion.",3,アプリケーションのドキュメントに、使用するすべての外部システムまたはサービス（データベース、ファイルハンドルなど）のリソース管理戦略が定義されていることを確認してください。,対象外,,要ドキュメント,L3要件であり対象外。,対象外,対象外,ドキュメント
V13,Configuration,V13.1,Configuration Documentation,V13.1.4,"Verify that the application's documentation defines the secrets that are critical for the security of the application and a schedule for rotating them, based on the organization's threat model and business requirements.",3,アプリケーションのドキュメントに、アプリケーションのセキュリティに不可欠なシークレットと、組織の脅威モデルに基づいたローテーションのスケジュールが定義されていることを確認してください。,対象外,,要ドキュメント,L3要件であり対象外。,対象外,対象外,ドキュメント
V13,Configuration,V13.2,Backend Communication Configuration,V13.2.1,"Verify that communications between backend application components that don't support the application's standard user session mechanism, including APIs, middleware, and data layers, are authenticated. Authentication must use individual service accounts, short-term tokens, or certificate-based authentication and not unchanging credentials such as passwords, API keys, or shared accounts with privileged access.",2,APIやデータ層など、アプリケーションの標準ユーザーセッションメカニズムをサポートしていないバックエンドアプリケーションコンポーネント間の通信が認証（authenticated）されていることを確認してください。,確認中,バックエンド間の通信認証において、パスワードではなくIAMロール（一時クレデンシャル）等の仕組みを利用するように設計・実装する。,対象外,IAMロール等によるコンポーネント間認証の実装有無が未確認のため確認中。,AWS IAM,未確認,インフラリソース
V13,Configuration,V13.2,Backend Communication Configuration,V13.2.2,"Verify that communications between backend application components, including local or operating system services, APIs, middleware, and data layers, are performed with accounts assigned the least necessary privileges.",2,バックエンドアプリケーションコンポーネント間の通信が、必要最小限の権限を割り当てられたアカウントで実行されることを確認してください。,確認中,バックエンドコンポーネント（ECSタスク等）に割り当てるIAMロールに対して、必要な権限のみを付与する最小特権の原則を適用する。,対象外,IAMポリシーの権限範囲が最小化されているか未確認のため確認中。,AWS IAM,未確認,インフラリソース
V13,Configuration,V13.2,Backend Communication Configuration,V13.2.3,"Verify that if a credential has to be used for service authentication, the credential being used by the consumer is not a default credential (e.g., root/root or admin/admin).",2,サービス認証（authentication）にクレデンシャルを使用する必要がある場合、コンシューマーが使用しているクレデンシャルがデフォルトのクレデンシャル（root/rootなど）ではないことを確認してください。,確認中,サービス認証にデフォルトのクレデンシャル（admin/admin等）を使用していないことを確認し、存在する場合は即座に変更する。,対象外,デフォルトクレデンシャルの利用有無が未確認のため確認中。,対象外,未確認,インフラリソース¥nソースコード
V13,Configuration,V13.2,Backend Communication Configuration,V13.2.4,"Verify that an allowlist is used to define the external resources or systems with which the application is permitted to communicate (e.g., for outbound requests, data loads, or file access). This allowlist can be implemented at the application layer, web server, firewall, or a combination of different layers.",2,アプリケーションが通信を許可されている外部リソースまたはシステムを定義するために、許可リストが使用されていることを確認してください。,確認中,アプリケーションが通信可能な外部リソースを、VPCのセキュリティグループ（アウトバウンドルール）等を用いて許可リスト（ホワイトリスト）方式で制限する。,対象外,セキュリティグループ等によるアウトバウンド制限が未確認のため確認中。,VPC,未確認,インフラリソース
V13,Configuration,V13.2,Backend Communication Configuration,V13.2.5,Verify that the web or application server is configured with an allowlist of resources or systems to which the server can send requests or load data or files from.,2,Webサーバーまたはアプリケーションサーバーが、リクエストの送信やデータの読み込みができるリソースまたはシステムの許可リストで構成されていることを確認してください。,確認中,アプリケーションサーバー（ECS等）からのアウトバウンド通信先が、セキュリティグループ等によって厳密に許可リスト化されているか確認する。,対象外,セキュリティグループ等によるアウトバウンド制限が未確認のため確認中。,VPC,未確認,インフラリソース
V13,Configuration,V13.2,Backend Communication Configuration,V13.2.6,"Verify that where the application connects to separate services, it follows the documented configuration for each connection, such as maximum parallel connections, behavior when maximum allowed connections is reached, connection timeouts, and retry strategies.",3,アプリケーションが個別のサービスに接続する場合、接続ごとに文書化された構成に従っていることを確認してください。,対象外,,対象外,L3要件であり対象外。,対象外,対象外,ソースコード
V13,Configuration,V13.3,Secret Management,V13.3.1,"Verify that a secrets management solution, such as a key vault, is used to securely create, store, control access to, and destroy backend secrets. These could include passwords, key material, integrations with databases and third-party systems, keys and seeds for time-based tokens, other internal secrets, and API keys. Secrets must not be included in application source code or included in build artifacts. For an L3 application, this must involve a hardware-backed solution such as an HSM.",2,バックエンドのシークレットを安全に作成、保存、アクセス制御、および破棄するために、キーコンテナなどのシークレット管理ソリューションが使用されていることを確認してください。,確認中,データベースパスワードやAPIキーなどのシークレットをソースコードにハードコードせず、AWS Secrets Manager等を利用して安全に管理する。,対象外,Secrets Manager等の利用有無が未確認のため確認中。,AWS Secrets Manager,未確認,インフラリソース
V13,Configuration,V13.3,Secret Management,V13.3.2,Verify that access to secret assets adheres to the principle of least privilege.,2,シークレット資産へのアクセスが、最小特権の原則に従っていることを確認してください。,確認中,AWS Secrets Manager等のシークレットにアクセスできる権限（IAMポリシー）が、それを必要とするECSタスク等にのみ最小限で付与されているか確認する。,対象外,シークレットへのアクセス権限が最小化されているか未確認のため確認中。,AWS IAM¥nAWS Secrets Manager,未確認,インフラリソース
V13,Configuration,V13.3,Secret Management,V13.3.3,Verify that all cryptographic operations are performed using an isolated security module (such as a vault or hardware security module) to securely manage and protect key material from exposure outside of the security module.,3,すべての暗号操作が、キー素材を安全に管理するために隔離されたセキュリティモジュール（HSMなど）を使用して実行されていることを確認してください。,対象外,,対象外,L3要件であり対象外。,AWS CloudHSM¥nAWS KMS,対象外,インフラリソース
V13,Configuration,V13.3,Secret Management,V13.3.4,Verify that secrets are configured to expire and be rotated based on the application's documentation.,3,シークレットがアプリケーションのドキュメントに基づいて期限切れになり、ローテーションされるように設定されていることを確認してください。,対象外,,対象外,L3要件であり対象外。,AWS Secrets Manager,対象外,インフラリソース
V13,Configuration,V13.4,Unintended Information Leakage,V13.4.1,"Verify that the application is deployed either without any source control metadata, including the .git or .svn folders, or in a way that these folders are inaccessible both externally and to the application itself.",1,.git や .svn フォルダを含むソース管理メタデータなしで、アプリケーションがデプロイされていることを確認してください。,未対応,.dockerignoreファイルを作成し、コンテナイメージのビルド時に.gitディレクトリ等が含まれないように除外設定を追加する。,対象外,.dockerignoreが存在せず、Dockerfileの `COPY . .` によって.git等のメタデータがコンテナイメージに含まれてしまう状態であるため未対応。,対象外,Dockerfile,ソースコード
V13,Configuration,V13.4,Unintended Information Leakage,V13.4.2,Verify that debug modes are disabled for all components in production environments to prevent exposure of debugging features and information leakage.,2,デバッグ機能の露出と情報漏洩を防ぐために、本番環境のすべてのコンポーネントでデバッグモードが無効になっていることを確認してください。,対応済み,,対象外,要件を満たしている。¥n本番環境のビルド（npm run build / npm start）では、Next.jsおよびFastifyのデバッグモードや開発用機能はデフォルトで無効化される。,対象外,Dockerfile,ソースコード
V13,Configuration,V13.4,Unintended Information Leakage,V13.4.3,Verify that web servers do not expose directory listings to clients unless explicitly intended.,2,明示的に意図されていない限り、Webサーバーがクライアントにディレクトリリストを公開しないことを確認してください。,対応済み,,対象外,要件を満たしている。¥nFastifyやNext.jsのデフォルトの挙動では、ディレクトリ一覧（ディレクトリリスティング）は公開されない。,対象外,server/service/app.ts,ソースコード
V13,Configuration,V13.4,Unintended Information Leakage,V13.4.4,"Verify that using the HTTP TRACE method is not supported in production environments, to avoid potential information leakage.",2,潜在的な情報漏洩を避けるために、本番環境でHTTP TRACEメソッドの使用がサポートされていないことを確認してください。,確認中,CloudFrontのビヘイビア設定やALBのリスナールールにて、HTTP TRACEメソッドを拒否（または許可リストから除外）しているか確認する。,対象外,インフラリソース（CloudFrontやALB等）でのHTTPメソッド制限設定に依存するため確認中。,CloudFront¥nALB,未確認,インフラリソース
V13,Configuration,V13.4,Unintended Information Leakage,V13.4.5,Verify that documentation (such as for internal APIs) and monitoring endpoints are not exposed unless explicitly intended.,2,明示的に意図されていない限り、ドキュメント（内部API用など）および監視エンドポイントが公開されないことを確認してください。,確認中,内部向けAPIのドキュメント（Swagger UI等）や監視用エンドポイントがインターネット経由で一般公開されないよう、ALBやWAF等でアクセス制御されているか確認する。,対象外,インフラリソース（WAFやALB等）での内部向けエンドポイントのアクセス制御設定に依存するため確認中。,ALB¥nAWS WAF,未確認,インフラリソース
V13,Configuration,V13.4,Unintended Information Leakage,V13.4.6,Verify that the application does not expose detailed version information of backend components.,3,アプリケーションがバックエンドコンポーネントの詳細なバージョン情報を公開しないことを確認してください。,対象外,,対象外,対象外。¥nL3要件であり対象外。,対象外,対象外,ソースコード
V13,Configuration,V13.4,Unintended Information Leakage,V13.4.7,"Verify that the web tier is configured to only serve files with specific file extensions to prevent unintentional information, configuration, and source code leakage.",3,意図しない情報やソースコードの漏洩を防ぐために、Web層が特定のファイル拡張子を持つファイルのみを提供するように構成されていることを確認してください。,対象外,,対象外,対象外。¥nL3要件であり対象外。,対象外,対象外,ソースコード
V14,Data Protection,V14.1,Data Protection Documentation,V14.1.1,"Verify that all sensitive data created and processed by the application has been identified and classified into protection levels. This includes data that is only encoded and therefore easily decoded, such as Base64 strings or the plaintext payload inside a JWT. Protection levels need to take into account any data protection and privacy regulations and standards which the application is required to comply with.",2,アプリケーションによって作成および処理されるすべての機密データが特定され、保護レベルに分類されていることを確認してください。,確認中,機密データの識別と保護レベルの分類が定義されたドキュメント（データ保護方針やセキュリティポリシー等）の記載内容を確認する。,確認中,ドキュメントにて機密データの識別と保護レベルの分類が定義されているか確認中。,対象外,未確認,ドキュメント
